Link,Key to folder,Country ,"Type (News, Magazines...)","Is there a ""not yes"" option? ","""Name"" of ""not yes"" options? Eg. more information, privacy choices etc. ","""Not- yes"" option is same widget as ""yes""? If no, what is it?  (Possible Answers: button, link, option box(es), drop-down menu) ",Location of pop-up box,Content scrollable while pop-up active?,"Number of words on ""options page”",Number of clicks until the “not-yes” option. Described in protocol how clicks are counted.,"Immediate visibility of ""not-yes"" or scroll down",Clarity of options,"Are cookies used and their functions listed. If yes, is this informative to a layperson? (subjective)",Is third-party privacy data handling used? If yes which? ,Can you still read the content if you opt out from all possible cookies? ,Is a dark pattern used? ,"""Are you sure"" message in the end.",,,,,,
http://www.avisen.dk,AvisenDK,Denmark,News,Yes,OK,"No, boxes","Middle of page, top-middle ",No,64,4,Immediate visibility: Boxes to check off on first pop up ,Good clarity: You can easily opt out of not neccessarily cookies. ,"Yes. Cookies are divided into 'Statistics', 'Marketing' and 'Prefrences'. Cookies are described in general terms, as well as all spesific cookie. ",No,Yes,Yes,No,,,,,,
http://www.nsk.se/,NSK,Sweeden,News,Yes,Läs mer,"No, link ","Bottom, entire ",Yes,348,9,Scroll down,Somewhat clarity: They direct you to another site with information of how to choose away cookies in your browser settings. That is the only option to unchose cookies.,"Yes, but cookies are only explained in general terms. No specific cookies are mentioned. ",No,"Yes, even when changing the browser setting to block all third-party cookies. (But you have to have a subscription)",Yes,No,,,,,,
https://www.agderposten.no/,Agderposten,Norway,News,Yes,Mer Informasjon,"No, link ","Bottom, middle",Yes,144,3,Immediate visibility after following the link on the pop up. ,"Good clarity: When following the link you get clear options of what to choose by, and you unchoose by clicking one button. ","Yes, but cookies are only explained in general terms. No specific cookies are mentioned. ",No,Yes,Yes,No,,,,,,
http://www.demokraten.no/,Demokraten ,Norway,News,Yes,Personvernerklæring,"No, link ","Bottom, middle ",Yes ,1616,8,Scroll down ,"Not very good: You can directly change some settings on you Facebook profile, use youronlinechoises (which I do not think work properly), or change browser settings, but the last one is not described how to do. ","Yes, but cookies are only explained in general terms. No specific cookies are mentioned. ",No,"Yes, even when changing the browser setting to block all third-party cookies. (But you have to have a subscription)",Yes,No,,,,,,
https://www.nytimes.com/,NYTimes,The US ,News,Yes,Cookie Policy ,"No, link ","Bottom, entire ",Yes,1548,7,Scroll down ,Somewhat clarity: You have to scroll down in the cookie policy to opt out of non-essential cookies + to find informtaion about how to change browser settings. ,"Yes, all cookies are listed, and cookie purposes are described in general terms. ",No,Yes,Yes. There is an X (looks like a close button) on the right side of the GDPR pop-up that actually means that the user accept (is written in the text in the GDPR pop-up),No,,,,,,
https://edition.cnn.com/,CNN,The US ,News,Yes,click here,"No, link ","Bottom, entire ",Yes,374,10,"Immediate, but you have to visit several different pages (e.g 'Preformance cookies' and 'Advertising cookies' to turn all off. ","At first: Good clairity: You can easily opt out both in general and advanced settings. But then: In advanced settings each cookie is lited, and even though you think you have opted out of all possible cookies, you have to manually visit several sites to opt out of all possible.  ","Yes, cookies are described in generall terms + specific cookies are named. ",No,Yes,Yes. There is an X (looks like a close button) on the right side of the GDPR pop-up that actually means that the user accept (is written in the text in the GDPR pop-up),No,,,,,,
forbes.com,Forbes,The US ,News,Yes,More Information,"Yes, buttons ","Top, middle","Yes, but greyed out ",110,2,Immediate ,"At first: Good clairity: You can easily opt out both in general and advanced settings. But then: In advanced settings each cookie is listed, and even though you think you have opted out of all possible cookies, you have to manually visit several sites to opt out of all possible.  ","Yes, if you go to advanced settings cookies are described in general terms + all cookies are listed. ",No,Yes,Yes,No,,,,,,
ap.org,AP,The US ,News,Yes,Cookie Settings,"No, link ","Bottom, entire ",Yes,564,8,Immediate,"Good claity. You can easily opt out of not necessary cookies, and the design is usable. ","Yes, cookies are described in generall terms + specific cookies are named. ",No,Yes,"Possible. There is an X button on the first pop up, but it is not specified what it does. ",No,,,,,,
http://www.dagbladet.no/,Dagbladet,Norway,News,Yes,Les mer,"Yes, buttons ","Bottom, middle ",Yes,352,No aID account: 11,Scroll down ,"Somewhat clarity: If you have an aID account it seems easy, but if not you have to manually change your browser settings, and visit several webpages an opt out from them. ","Cookies are used, but only described in general terms. It does not seem like all used cookies are listed. ","Yes, aID",Yes,Yes,No,,,,,,
http://www.aasavis.no/,Aavis,Norway,News,Yes,Logg inn med aID' or 'Les mer',"No, links ","Bottom, middle",Yes,,With aID account: 12 ,Scroll down ,"Not good clarity: If you have an aID account, it is okay, but if you do not have an account it is little information about how to opt out off cookies. ","Cookies are used, but you have to look closly to find information about cookies, and it is only general. No specific cookies are listed. ",No,Yes,Yes,No,,,,,,
http://www.bladet.no/,Bladet ,Norway,News,Yes,Jeg vil vite mer,"No, link","Bottom, middle",Yes,3805,"13 (follow their link on how to change browser settings + youronlinechoices.com, and then back to the main page)",Scroll down ,"Not good: You have to go through a lot of text before finding information about how to opt out. You need to have an Schibsteds account, change browser settings, and/or use websides such as youronlinechoices.com","Yes, cookies are used, and most are listed and described. It is understandable what is described, but it can be dificult to find it. ","Yes, Schibsted ",Yes,Yes,No,,,,,,
http://www.budstikka.no/,Budstikka,Norway,News,Yes,Les mer,"Yes, buttons ","Top, middle",Yes,2718,With aID account: 13 ,Scroll down ,"Okay clarity if you have or make an aID account. If not, you have to opt out using Google's services + youronlinechoices","Cookies are used, and described in general terms. No specific cookies are listed. ","Yes, aID",Yes,Yes,No,,,,,,
https://www.buzzfeed.com/,Buzzfeed,The US ,News,Yes,Show Purposes,"No, link ","Bottom, entire, 1/3 of page",No,794,3,Immediate ,Good clarity: You can easily opt out of not neccessarily cookies by clicking 'Reject all',"Yes, cookies are used, and all cookies are listed. A general description of each cookie catregory is given. ",No,Yes,Yes,No,,,,,,
https://www.bloomberg.com/europe,Bloomberg,The US ,News,Yes,Submit prefrences,"Yes, you select you prefrences (on/off button) and press 'Submit prefrences'","Top, middle, 1/2 page","Yes, but greyed out ",546,3,Immediate ,"Very good clarity. The user get presented all options in the first pop up window, and can easily opt out of not necessary cookies. ","Yes, cookies are used, and all cookies are listed. A general description of each cookie catregory is given. ",No,Yes,Yes,No,,,,,,
https://www.bbc.com,BBC,The UK,News,Yes,"No, take me to settings","No, link ","Top, entire ",Yes,265,Inside the UK: 0               The rest of the world: 10,Inside the UK: Immediate The rest of the world: Scroll down,Inside the UK: Very good. Settings are already on not showing personalised advertising. For the rest of the world: Have to read about how to change browser settings. ,"Yes, cookies are used, and all cookies are listed. A description of each individual cookie is given. ",No,Yes,Yes,No,,,,,,
https://www.nbc.com/,NBC,The US ,News,Yes,Cookie Policy ,"No, link","Bottom, entire ",Yes,1353,"11 (from pop up, to changing browser settings, to main page)",Scroll down ,"Not very good clarity: You have to scroll down a lot of text to find you options, and if you want to opt out you have to visit several websites and opt out there, or change browser settings. ",Only general information about cookie categories are listed. ,No,Yes,Yes,No,,,,,,
https://www.newyorker.com/,NewYorker,The US ,News,Yes,Cookie Settings,"No, link ","Bottom, entire ",Yes,459,10 (turn off all settings + save) ,Immediate ,"Good clarity in options: Cookies are presented in categories, which you can easily opt out off by clicking a button in each categorie. ","Yes, all cookies are listed, and cookie purposes are described in general terms. ",No,Yes,Yes,No,,,,,,
https://www.politico.eu/,Politico,The US ,News,Yes,More Information,"No, link","Bottom, entire, 1/3 of page",Yes,410,3,Immediate,"Good clarity in options: There is one 'Reject all' button, and possibility to turn off seperatly. ","Yes, cookies are described in generall terms + specific cookies are named. ",No,Yes,Yes,No,,,,,,
https://www.rollingstone.com/,RollingStone,The US ,Magazine,Yes,DENY ALL,"Yes, buttons ","Middle of page, middle",No,65,1,Immediate ,Good clarity: In the first pop up you can deny all cookies and similar technologies with just one click. ,"Yes, if you press 'See full vendor list' you get a list of all cookies. ",No,Yes,Yes,No,,,,,,
https://www.theatlantic.com/world/,Atlantic,The US ,News,Yes,I Do Not Accept,"Yes, buttons ","Top to bottom, middle",No,112,1,Immediate,Good clarity: In the first pop up you can deny all cookies and similar technologies with just one click. ,"Yes, cookies are described in general terms + you can get list of all third party vendors. ",No,Yes,Yes,No,,,,,,
https://www.wsj.com/europe,WSJ,The US ,News,Yes ,Cookie Policy ,"No, link","Middle-top, entire",Yes,2751,"14 (from pop up, to changing browser settings, to main page)",Scroll down ,"Not good clarity: Their cookie policy directs you to another site with tips on how to change browser settings, but it is not a very clear site. ","Yes, cookies are used and listed, and general descriptions of cookie categories are given + descriptions off each seperate cookie. ",No,Yes,"Yes (?). There is not an 'yes' or 'accept' button on the first pop up, but if you press the X button or contrinue to use their site you agree with their terms.  ",No,,,,,,
https://www.afp.com/en,AFP,France,News,Yes,More Information,"Yes, buttons ","Top, entire ",Yes,2135,"11 (from pop up, to changing browser settings, to main page)",Scroll down ,"Not very good clarity: You have to scroll down a lot of text to find you options, and if you want to opt out you have to visit several websites and opt out there, or change browser settings. ","Cookies are used, but which are not listed (only general categories) + information about general cookie categories. ",No,Yes,Yes,No,,,,,,
https://www.cnbc.com/world/?region=world,CNBC,The US ,News,Yes,Cookie Policy ,"No, link","Bottom, entire ",Yes,1353,"11 (from pop up, to changing browser settings, to main page)",Scroll down ,"Not very good clarity: You have to scroll down a lot of text to find you options, and if you want to opt out you have to visit several websites and opt out there, or change browser settings. ","Cookies are used, and general cookie categories are described. No specific cookies are named.  ",No,Yes,Yes,No,,,,,,
https://www.economist.com/,Economist,The UK,News,Yes,manage your cookies,"No, link","Top, entire ",Yes,169,12 to opt out of those possible directly from main page. ,Scroll down ,"Not good:They offers buttons to opt out off the cookie comapnies based on categories, but many off the cookie vendors do not let you opt out through the Economist website. A lot of companies require the user to opt out from their own homepage, making it a great job for the user to opt out off all possible. One company was in Chinees, without any translation alternatives. ","Yes, cookies are used, and each cookie and its purpose is listed. ",No,Yes,Yes,No,,,,,,
https://www.france24.com/en/,France24,France,News,Yes,Learn more,"No, link","Bottom, entire",Yes,2717,"11 (from pop up, to changing browser settings, to main page)",Scroll down ,"Not very good clarity: You have to scroll down a lot of text to find you options, and if you want to opt out you have to visit several websites and opt out there, or change browser settings. ","All cookies are listed, their placer, their purpose and their timeframe. Cookies are divieded into categories which are described in general terms,",No,Yes,Yes,No,,,,,,
https://huffpost.com/,Huffpost ,The US ,News,Yes,Manage options,"No, link",Whole page ,No,480,8 (to opt out of all possible without visiting third party websites) ,Immediate,"Not good: At first it seems like it will be easy to manage options, but it is not. You have to click on several buttons before comming to the page where you can opt out of several ad companies. At first it looks like you can opt out of all by clicking one button, but if you read the text you can see that you have to visit several of the companies sites to manually opt put of those. If you are a member of EU you can use the youronlinechoises link. ",Cookies are not mentioned or described. Huffpost refers to their 'partners' and fucntionality. ,Yes,Yes,Yes,No,,,,,,
https://www.cbs.com/,CBS,The US ,News,Yes,Manage Settings,"Yes, buttons","Bottom, entire ",Yes,421,3 (opt out all button)       11 changing Internet settings,Immediate ,"It is easy to opt out off the cookie comapnies that offers the possibility to opt out of their services from the CBSs homepage. A lot of companies require the user to opt out from their own homepage, making it a great job for the user to opt out off all possible. CBS also give information on how to change Internet settings.",All cookies are listed. A general overview of what cookies are is described. ,No,Yes,Yes,No,,,,,,
https://www.msn.com/nb-no/,MSNno,Worldwide (no headquarters mentioned) ,News,Yes,Administrer anonse-informasjonskapsler,"Yes, buttons","Middle of page, middle",Yes,161,4,Immediate ,"Good clarity: You can easily opt out of all cookies by clicking a button, optionally select those you prefer. ","Cookies are used, but there is no specific explinations or categories for them. Just a long list. ",No,Yes,Yes,No,,,,,,
https://www.washingtonpost.com,WashingtonPost,The US ,News,"Yes, but it cost money","Premium
EU Ad-Free

$9 every 4 weeks or just $117 $90/year
","Yes, buttons",Whole page ,No,126,? Did not buy subrscription. Suspect it will be some clicks until subscription is filled out. ,Immediate ,"Good clarity: If you want to use the site without cookies, you have to pay. I tried using the free version with restricted cookie settings (browser settings), but it was not possible. ","Cookies are used and described in general categories, + partners that provides cookies are listed. ",No,No,Yes,No,,,,,,
https://www.theguardian.com/us,TheGuardian,The UK,News,Yes,My options,"No, link","Bottom, entire 1/3 of page",Yes,245,Opt out of personal advertising: 4               Opt out off all cookies: 13 (browser settings) ,Immediate ,"At first: Very good: After clicking 'My options' you get two choices (buttons): Accept or not accept personalised ads. But this might seem to only opt out some cookies (advertising), so to opt out off all you have to read more into their cookie policy where they direct you to a site showing how to change browser settings. ","Cookies are used, and some third parties are listed. Elsewise, cookie categories are described in general terms.",No,Yes,Yes,No,,,,,,
https://www.washingtontimes.com/,WashingtonTimes,The US ,News,Yes? ,Not This Time,"No, link",Whole page ,No,106,1,Immediate ,Unclear: I'm not sure what happens when I click 'Not this time'. There are not further links to Cookie policies or similar. You have to look at the bottom of the main page to find their 'Privacy policy',"Cookies are used, butto find information about it you have to consult their privacy policy where cookies are described in general terms.",No,Yes,Yes,No,,,,,,
https://www.namdalsavisa.no/,Namdalsavisa,Norway,News,Yes,Jeg vil vite mer,"No, link ","Bottom, almost entire, 1/3 of page",Yes,3813,"14 (From pop up, following their tips to change browser settings, to main paige again)",Scroll down,"Not good: You have to go through a lot of text before finding information about how to opt out. You need to have an Schibsteds account, change browser settings, and/or use websides such as youronlinechoices.com","Yes, cookies are used, and cookie companies are listed. It is understandable what is described, but it can be dificult to find this infomration. ","Yes, Schibsted ","Not sure, you need to have a subscription to read their articles. ",Yes,No,,,,,,
https://www.sognavis.no/,Sognavis,Norway,News,Yes,Les meir ,"No, link ","Bottom, entire",Yes,1398,6 (when already logged into your Google account). Changing Google settings + unsubscribe all in one button on youonlinechoices ,Scroll down,"Not very good: In their 'Personvernserklæring' they state that users that have an Google account can change their settings there, and thet the user can opt out off some cookies at  http://www.youronlinechoices.com. They do not specify how to change Internet settings. ","It is very little information about cookies, they only mention that they use them. ",No,Yes,Yes,No,,,,,,
https://www.berlingske.dk/,Berlingske,Denmark,News,Yes,Instillinger,"No, drop-down menu","Middle of the page, middle ",No,956,"8 (diselected all possible cookie categories + advertising, and pressed OK)",Immediate ,"Very good: When you click 'Instillinger' you can easily opt out of cookies based on categories, and the same is for advertising. ","Yes, cookies are used, and each and every one is described in detail. The same goes for advertisers. ",No,Yes,Yes,No,,,,,,
https://borsen.dk/,Borsen,Denmark,News,Yes,Vis detaljer,"No, link ","Middle of the page, middle ",No,X,3,Immediate ,It is very easy to opt out of not necessary cookies. ,"Cookies are used, but there is no specific or general information about them. ",No,Yes,Yes,No,,,,,,
https://www.direktpress.se/,Direktpress,Sweeden,News,Yes,Läs mer,"No, to agree you click X or continue using page. To read more you press the button 'Läs mer'","Bottom, entire",Yes,2271,11 (turn off cookies in browser settings),Scroll down,"Not good. In their policy they shortly write that the user can change their browser settings regarding cookies, but they do not link to how to do this, or mention similar technologies. ","Cookies are used, but there is no specific or general information about them. ",No,Yes,Yes,No,,,,,,
https://www.stockholmdirekt.se/,StockholmDirekt,Sweeden,News,Yes,Instillinger,"No, drop-down menu","Bottom, entire, 1/3 of page",Yes,316,5,Immediate ,Very good: When you click 'Instillinger' you can easily opt out of cookies based on categories.,"Yes, cookies are used, and each and every one is described in detail.",No,Yes,Yes,No,,,,,,
https://www.tv2.no/,TV2,Norway,News,Yes,personvernpolicy,"No, link ","Bottom, entire",Yes,540,"12 (from pop up, following their instructions to change browser settings, and back to main page)",Scroll down,"Somewhat good: You click into their privacy policy, then how to manage cookies, and there they describe (no link) how to change browser settings. ","Yes, cookies are used, cookie categories are described, and all cookies and their companies are listed. ",No,Yes,Yes,"Yes, if you have changed your browser settings. ",,,,,,
http://klt.nu/,KLT,Sweeden,News,Yes,användarvillkor,"No, link ","Bottom, entire (have to scroll down to bottom)",Yes,3895,"14 (from pop up, following their instructions to change browser settings, and back to main page)",Scroll down,Not very good: You have to scroll down a lot of information to find the 'cookie sections' where they redirect you to another page instructing you how to change browser settings. ,"Yes, cookies are used and a general description of purposes are listed. A list of cookies names is also available. ",No,Yes,Yes,No,,,,,,
https://www.jnytt.se/,Jnytt,Sweeden,News,Yes,Läs policy ,"Yes, buttons","Under header, entire, 1/4 of page",Yes ,869,2,Immediate ,Very good: At the bottom of their policy (a pop up) you have two buttons: to accept or not. ,"Cookies are used and described in vague terms, but not more. ",No,Yes,Yes,No,,,,,,
https://finansavisen.no/,Finansavisen,Norway,News,Yes,Les vår nye personverneklæring,"No, link ","Bottom, entire ",Yes,621,,Scroll down,"Vague options: Only mentiones in one sentence that you can change your browser settings, but not a good description of how. ","Cookies are used, but only a very vague description + mentions cookie companies. ",No,"Yes, but you have to have a subscription",Yes,No,,,,,,
https://www.herningfolkeblad.dk/,Herningfolkeblad,Denmark,News,Yes,tilbagekalder dit samtykke her,"No, link ","Middle of page, middle",No,610,"12 (from pop up, following their instructions to change browser settings, and back to main page)",Scroll down,"Not very good: On their policy page they link to a lot of privacy polices of thir party companies, and one of these instrcut you on how to change browser settings. ","Cookies are used, and all cookies are listed together with their company, purposes, and life span.",No,Yes,Yes,No,,,,,,
https://ballerupbladet.dk/,Ballerupbladet,Denmark,News,Yes,Læs mere,"No, link ","Almost bottom, right corner ",Yes,708,"13 (from pop up, following their instructions to change browser settings, and back to main page)",Scroll down,"Okay enough to understand: You have to look through some text, but it is not too much and it is divided into catrgories. Ypu have to visit a third party website to get instructions on how to change browser settings. ","Cookies are used, and the purpose is described in general and understandable terms. No cookies are listed.",No,Yes,Yes,No,,,,,,
https://bornholm.nu/,Bornholm,Sweeden,News,Yes,samarbejdspartnere' or 'privatlivspolitik',"No, link ","Middle of page, middle",No,1070,Do not tell you how to opt out,Scroll down,"Not good: They state that you can delete or clock cookies, but give no further information. ","Yes, they state that they and thrid party companies have cookies on their page, but do not list any.",No,Yes,"Yes (?) When you use the no option (privacy policy) the GDPR pop up is still in the middle of the page, and you have to press OK for it to disapair. ",No,,,,,,
https://www.dailystar.co.uk/,DailyStar,The UK,Magazine,Yes,Manage,"No, link ","Bottom, entire, 1/3 of page","Yes, but greyed out ",94,4,Immediate ,"Good: You can easily opt out off all cookies, and options are presented in the pop up. ","Yes, cookies are used and a list of all cookies is presented. ",No,Yes,Yes,Yes (screenshot),,,,,,
https://www.thesun.co.uk/,TheSun,The UK,News,Yes,Cookie Settings,"Yes, buttons","Bottom, entire ",Yes,785,13,Immediate ,Very good: You can easily opt out of all vendors and deselect not necessary cookies based on categories. ,"Cookies categories and purposes are described, but no cookies are listed. ",No,Yes,"Yes (?). If you scroll down you accept their policy, and the pop up does not appear again if you revisit the webpage.",No,,,,,,
https://www.mirror.co.uk/,Mirror,The UK,News,Yes,Manage,"No, link ","Bottom, entire, 1/3 of page","Yes, but greyed out ",162,7,Immediate ,Very good: You can easily opt out of either all purposes of data collection or partners. ,"Cookies are used, and cookie partners and purposes are listed. No good descriptions of cookies (not even in general terms). ",No,Yes,Yes,No,,,,,,
https://www.dailymail.co.uk/home/index.html,DailyMail,The UK,News,Yes,Privacy settings and Policy,"No, link ","Bottom, entire, almost 1/2 of page",Yes,567,4,Immediate ,Very good: You can easily opt out of personalised advertising (not necessary cookies),"Yes, but cookies are mentioned with few words. They mostly write about data they collect and advertising. ",No,Yes,Yes,Yes (screenshot),,,,,,
https://www.nationalgeographic.com/,NationalGeo,The US ,Magazine,Yes,Cookies Policy,"No, link ","Bottom, entire",Yes,2075,"11 (from pop up, following their instructions to change browser settings, and back to main page)",Scroll down,"Okay enough to understand: You have to look through some text, but it is not too much and it is divided into catrgories. You have to visit a third party website to get instructions on how to change browser settings. ","Cookies are described in general terms, divided into categories, and purposes described. All coookies are listed. ",No,Yes,Yes,No,,,,,,
https://www.ok.co.uk/,OKMagazineUK,The UK,Magazine,Yes,Manage,"No, link","Bottom, entire, 1/3 of page","Yes, but greyed out ",166,7,Immediate ,Very good: You can easily opt out of either all purposes of data collection or partners. ,"Cookies are used, and cookie partners and purposes are listed. No good descriptions of cookies (not even in general terms). ",No,Yes,Yes,No,,,,,,
https://www.cosmopolitan.com/,Cosmopolitan,The US ,Magazine,Yes,Learn More,"No, link ","Middle of page, middle","Yes, but greyed out ",599,2,Immediate ,Very good: You can deny all Internet based advertising cookies in one click. ,Cookies are used and described in general terms. All Internet based advertising cookies are listed.  ,No,Yes,Yes,No,,,,,,
