https://www.vogue.com/,Vogue,The US ,Magazine,Yes,Cookie Settings ,"No, link (?)","Bottom, entire","Yes, but greyed out ",463,10,Immediate ,"Very good: Cookies are divided into categories in the settings, and you can opt out of not necessary cookies by clicking one button for each. ","Cookies are used and divided into categories, which are described. ",No,Yes,Yes,No,,,,,,
https://denkorteavis.dk/,DenkortAvis,Denmark,News,No,-,-,"Bottom, entire",Yes,19,10 (by knowing how to change browser settings) ,-,"Bad: You have no option, just accept. ","Cookies are used, but no information about it. ",No,-,Yes,No,,,,,,
https://www.dknyt.dk/,DKNytt,Denmark,News,Yes ,klikke her,"No, link ","Bottom, entire",Yes,244,10 (by knowing how to change browser settings) ,-,Bad: You have no option regarding cookie settings. They only state that you can contact them if unsure about something.. ,Cookies are used and the purpose is explained in general terms. Cookies are not shared with third parties. ,No,-,Yes,No,,,,,,
http://dragoer-nyt.dk/,DragoerNyt,Denmark,News ,Yes,Reject,"Yes, buttons","Bottom, entire",Yes,18,1,Immediate ,Very good: You can reject cookies by pressing one button in the pop up. ,A very general description of cookies is given. No specific cookies and purposes listed. ,No,Yes,Yes,No,,,,,,
https://fjendsfolkeblad.dk/,FjendsFolkeblad,Denmark,News ,Yes,tilbagekalder dit samtykke her,"No, link","Middle of page, middle",No,387,"10  (from pop up, following their instructions to change browser settings, and back to main page)",Scroll down ,"Okay enough to understand: You have to look through some text, but it is not too much and it is divided into catrgories. You have to visit a third party website to get instructions on how to change browser settings.","Cookies are used and divided into categories, which are described. All cookies, their purposes and time frames are listed.",No,Yes,Yes,No,,,,,,
https://folketidende.dk/,FolkeTidende,Denmark,News ,Yes,samarbejdspartnere' or 'privatlivspolitik',"No, link ","Middle of page, middle","Yes, but greyed out ",1892,"11 (from pop up, following their instructions to change browser settings, and back to main page)",Scroll down ,"Okay enough to understand: You have to look through some text, but it is not too much and it is divided into catrgories. You have to visit a third party website to get instructions on how to change browser settings.","Cookies are used and divided into categories, which are described. All cookies, their purposes and time frames are listed.",No,Yes,Yes,No,,,,,,
https://graastenavis.dk/,GraastenAvis,Denmark,News ,Yes,Læs mere ,"Yes, buttons","Bottom, entire ",Yes,594,"11 (from pop up, following their instructions to change browser settings, and back to main page)",Scroll down ,"Not very good: You get redirected to several sites for information about cookies, different types, and how to opt out. ","Cookied are used, and general information about different cookie types and purposes are given. No specifc cookies are listed. ",No,Yes,Yes,"Yes, but in a positive way: That state that if you click 'OK' one more time they assume that you know what you are agreeing to. ",,,,,,
https://www.midtjyllandsavis.dk/,MidtjyllandsAvis,Denmark,News ,Yes,persondatapolitik her,"No, link","Middle of page, middle",No,1682,"11 (from pop up, following their instructions to change browser settings, and back to main page)",Scroll down ,"Okay enough to understand: You have to look through some text, but it is not too much and it is divided into catrgories. You have to visit a third party website to get instructions on how to change browser settings.","Cookies are used and divided into categories, which are described. All cookies, their purposes and time frames are listed.",No,Yes,Yes,No,,,,,,
https://aalborgnu.dk/,Aalborgnu,Denmark,News ,Yes,Vis detaljer,"No, link","Bottom, entire",Yes,452,"11 (from pop up, following their instructions to change browser settings, and back to main page)",Scroll down ,"Okay enough to understand: You have to look through some text, but it is not too much and it is divided into catrgories. You have to visit a third party website to get instructions on how to change browser settings.","Cookies are used and divided into categories, which are described. All cookies, their purposes and time frames are listed.",No,Yes,Yes,No,,,,,,
https://www.tmz.com/,TMZ,The US ,Magazine,Yes,Cookie Settings ,"No, link ","Top, entire",Yes,410,2,Immediate ,Good clarity: In cookie settings cookies are divided into different categories where you can turn off those that are not necessary. ,"Cookies are used and divided into categories, which are described generally. All cookies are listed.",No,Yes,Yes,No,,,,,,
https://perezhilton.com/,PerezHilton,The US ,Magazine/Blog,Yes,PRIVACY POLICY,"Yes, buttons","Bottom, entire",Yes,2669,11 (by knowing how to change the settings),Scroll down ,"Not good: It is a lot of text to read through, and it tells you to use the 'Help' bar of your browser to be reserved toward cookies. ","Cookies are used, but the describtion is vague, and no specific cookie information is given. ",No,Yes,Yes,No,,,,,,
https://www.celebsnow.co.uk/,CelebsNow,The UK,Magazine,Yes,Show Purposes,"No, link","Middle of page, middle",No,889,13,Immediate ,Good clarity: You can easily turn off the different purpose settings available on this page. ,"Cookies are used, and a list of cookie vendors and their purposes are described. It is understandable. ",No,Yes,Yes,No,,,,,,
http://sallingavis.dk/,SallingAvis,Denmark,News ,Yes,Læs mere ,"No, link","Botton of page, half",Yes,741,"11 (from pop up, following their instructions to change browser settings, and back to main page)",Scroll down ,"Okay enough to understand: You have to look through some text, but it is not too much and it is divided into catrgories. You have to visit a third party website to get instructions on how to change browser settings.","Cookies are used, but vague general information about typical usage is given. It is understandable, but not that much information. No specific cookie comapnies or similar is listed. ",No,Yes,Yes,No,,,,,,
https://sermitsiaq.ag/,Sermitsiaq,Denmark,News ,Yes,Vis detaljer,"No, drop-down menu","Bottom, entire, 1/3 of page",Yes,335,"Can't turn the cookies off in pop up settings, so you have to press 'agree' and then go to 'Cookies' at the bottom of the homepage and withdraw the concent. 3",Scroll down ,"Not good: You have to agree to their conditions in the pop up, and the withdraw the concent later in their 'Cookies' page. ","Cookies are used and divided into categories, which are described. All cookies, their purposes and time frames are listed.",No,Yes,"Yes, see 'Clarity of options'",No,,,,,,
http://tidende.dk/,Tidende,Denmark,News ,Yes,Du kan læse mere her,"No, link","Bottom, entire ",Yes,1364,11 (by knowing how to change the settings),Scroll down ,"Not good: They only state that you can change your browser settings, but no information of how to do it. ",Cookies are used and described in general terms. No specific cookie information is given. ,No,Yes,Yes,No,,,,,,
https://udfordringen.dk/,No,Denmark,News ,Yes,Læs mere ,"No, link","Bottom, entire ",Yes,110,11 (by knowing how to change the settings),Scroll down ,"Not good: They only state that you can change your browser settings, but no information of how to do it. ",Cookies are used and described in general/vague terms. No specific cookie information is given. ,No,Yes,Yes,No,,,,,,
https://www.marieclaire.com/,MarieClaire,France/UK,Magazine,Yes,Learn More,"No, link","Middle of page, middle","Yes, but greyed out ",599,2,Immediate ,Very good: You can decline all not necessary cookies by clicking one button. ,Cookies and purposes are described in a general way. All cookies are listed. ,No,Yes,Yes,No,,,,,,
https://themaclife.com/,MacLife,Worldwide (no headquarters mentioned) ,Magazine,Yes,Find Out More. ,"No, link ","Bottom, entire",Yes,788,11 (by knowing how to change the settings),Scroll down ,"Not good: They only state that you can change your browser settings, but no information of how to do it. ",Cookies are used and described in general terms. No specific cookie information is given. ,No,Yes,Yes,No,,,,,,
https://www.maxim.com/,Maxim,The US ,Magazine,Yes,More Information,"No, link","Middle of page, top to bottom","Yes, but greyed out ",863,3,Immediate ,Very good: You can decline all not necessary cookies by clicking one button. ,Cookies and purposes are described in a general way. All cookies are listed. ,No,Yes,Yes,No,,,,,,
https://www.hellomagazine.com/,HelloMagazine,The UK,Magazine,Yes,Options,"No, link ","Bottom, entire, 1/3 of page",Yes,462,7,Immediate ,Very good: You easily understand what you can opt out from and not. ,Cookies are described in general and for different purposes. All cookie companies are listed. ,No,Yes,Yes,No,,,,,,
https://news.sky.com/,SkyNews,The UK,News,Yes,privacy options,"No, link","Middle of page, middle",No,264,2,Immediate ,Very good: You easily understand what you can opt out from and not. You can opt out from everything possible by one click. ,"Cookie categories and their purposes are described in an understandable way. All cookies are listed, except for essential cookies, which are only described. ",No,Yes,Yes,No,,,,,,
https://news.vice.com/en_us,Vice,The US ,News,Yes,Configure Prefrences,"Yes, buttons","Middle of page, middle",No,559,2,Immediate ,Very good: You easily understand what you can opt out from and not. You can opt out from everything possible by one click. ,Cookie categories and their purposes are described in an understandable way. All cookies are listed. ,No,Yes,Yes,No,,,,,,
https://www.vox.com/,Vox,The US ,News,Yes,Cookie Policy,"No, link","Bottom, amlost 1/2 page",Yes,3693,11 (by knowing how to change the settings),Scroll down ,"Not very good: They direct you to http://optout.aboutads.info/?lang=EN&c=2#!%2F or tell you to change your browser settings. If you follow the link you get presented a lot of cookies you can opt out from, but when you click 'Op out of all', they only manage to opt you out of a few of those.","Cookies are used, and described based on categories. It is understandble. ",No,Yes,Yes,No,,,,,,
https://ugeavisenkarup.dk/,UgeAvisenKarup,Denmark,News ,Yes,tilbagekalder dit samtykke her,"No, link","Middle of page, middle",No,388,11 (by knowing how to change the settings),Scroll down ,"Not good: They only say that you can delete cookies (not opt out), and direct you to a site on how to delete cookies. ",Cookies are used and described in general terms. A list of all cookies used is given.,No,"Yes, if you change browser settings to block all cookies you can still read articles, but you get the pop up window at every article you visit. ",Yes,No (?),,,,,,
https://aars.dk/,Aars,Denmark,News ,Yes,hér,"No, link","Bottom, entire ",Yes,726,"13 (from pop up, following their instructions to change browser settings, and back to main page)",Scroll down ,Not very good: You get redirected to another page about deleting cookies or private browsing. In this page another link directs you how to block cookies.,Cookies are used and described in general terms.,No,Yes,Yes,No,,,,,,
https://www.altinget.dk/,Altinget,Denmark,News ,Yes,cookie- og privatlivspolitik,"No, link","Almost top, 1/3 of page, middle",Yes,1579,"13 (from pop up, following their instructions to change browser settings, and back to main page)",Scroll down ,Not very good: You get redirected to another page about deleting cookies or private browsing. In this page another link directs you how to block cookies.,Cookies are used only for statistic purposes. A list of cookie companies is given. ,No,"Yes, if you change browser settings to block all cookies you can still read articles, but you get the pop up window at every article you visit. ",Yes,No (?),,,,,,
https://www.fla.de/wp/,Fla,Denmark,News/German? ,Yes,Privacy policy ,"Yes, buttons","Top, entire",Yes,,,,,,,,Yes,,,,,,,
https://www.information.dk/,Information,Denmark,News ,Yes,Læs mere ,"No, link","Bottom, entire",Yes,308,"13 (from pop up, following their instructions to change browser settings, and back to main page)",Scroll down ,Not very good: You get redirected to another page about deleting cookies or private browsing. In this page another link directs you how to block cookies.,"Cookies are used and described in general terms. A list of all cookies used is given, including their purpose and time frame.",No,"Yes, if you change browser settings to block all cookies you can still read articles, but you get the pop up window at every article you visit. ",Yes,No (?),,,,,,
https://kjavis.dk/,Kjavis,Denmark,News ,Yes,Cookie- og privatlivspolitik,"Yes, links","Top, entire",No,706,"13 (from pop up, following their instructions to change browser settings, and back to main page)",Scroll down ,Not very good: You get redirected to another page about deleting cookies or private browsing. In this page another link directs you how to block cookies.,Cookies are used and described in general terms.,No,"Yes, if you change browser settings to block all cookies you can still read articles, but you get the pop up window at every article you visit. ",Yes (?). You have to agree to their pop up to be able to read their policy. ,No (?),,,,,,
https://www.kristeligt-dagblad.dk/,KriteligtDagblad,Denmark,News,Yes,samtykke her,"No, link","Middle of page, middle",No,522,X,Scroll down ,"Not good: If you want to block cookies you get redirected to a webpage about your browser (Ex. Firefox), but this page did not have any information about cookies. ","Cookies are used and described in general terms. A list of all cookies used is given, including their purpose and time frame.",No,"Yes, if you change browser settings to block all cookies you can still read articles, but you get the pop up window at every article you visit. ",Yes,No,,,,,,
https://www.npr.org/,NPR,The US ,News,Yes,Decline and Visit Plain Text Site,"Yes, buttons",Whole page,No,593,1,Immediate,"Very good: You can either choose to accept their terms, or decline them. If you decline you can easily go back and accept. ",Cookies are used and described in general terms. No specific cookies listed. ,No,"Yes, but only a plain text site: No images, layout or anythings. ",Yes,No,,,,,,
https://www.independent.co.uk/,IndependentUK,The UK,News,Yes,Show Purposes,"No, link ","Bottom, enitre, 1/3 of page",Yes,1831,2,Immediate,Good: From the first pop up you are directed to another pop up where cookie categories can be turned on/off. You can reject or accept all in own buttons. ,Cookies are described in an understandable and thourough way. All cookie companies are listed. ,No,Yes,Yes,No,,,,,,
https://www.rt.com/news/,RT,Russia,News,Yes,Privacy policy,"No, link ","Bottom, entire ",Yes,6196,11 (by knowing how to change the settings),Scroll down ,"Not good: There is a lot of text on their page, but only two sentences concerning how to block cookies. They say that the user can use http://www.youronlinechoices.com or similar, but this site does not block all cookies.","Cookies are described in a general way + all cookies, purposes and time frames are listed. There is too much information in the page. ",No,"Yes, if you change browser settings to block all cookies you can still read articles, but you get the pop up window at every article you visit. ",Yes,No,,,,,,
https://midtvendsysselavis.dk/forside.aspx,MidtvendsysselAvis,Denmark,News ,Yes,Nej tak,"Yes, buttons","Bottom, entire ",Yes,37,1,Immediate,Very good: You can click 'No' in the pop up. ,Cookies are used and described in general + purposes if you press 'Læs mere' in the pop up. ,No,Yes,Yes,No,,,,,,
http://www.skagensavis.dk/,SkagenAvis,Denmark,News ,No,-,-,"Top, entire, almost 1/2 of page",Yes,105,-,Immediate,Not good: You can only accept. ,No cookie information. ,No,"They state that you can't, but if you change browser settings to block cookies you can still read articles. ",Yes,No,,,,,,
https://www.skivefolkeblad.dk/,SkriveFolkebladet,Denmark,News ,Yes,Mere info,"No, link","Bottom, entire ",Yes,2055,11 (by knowing how to change the settings),Scroll down ,"Not good: They only state that you can change your browser settings, but no information of how to do it. ",Cookies are described in a general way. ,No,"Yes, if you change browser settings to block all cookies you can still read articles, but you get the pop up window at every article you visit. ",Yes,No,,,,,,
https://www.sydtid.dk/,Sytid,Denmark,News ,Yes,"Nej, jeg ønsker mere informasjon","No, link","Bottom, entire ",Yes,664,"13 (from pop up, following their instructions to change browser settings, and back to main page)",Scroll down ,Not very good: You get redirected to another page about deleting cookies or private browsing. In this page another link directs you how to block cookies.,A general cookie description is given. No specific cookies listed. ,No,Yes,Yes,No,,,,,,
http://www.tv2bornholm.dk/,TV2Bornholm,Denmark,News ,Yes,Mere om cookies på tv2bornholm.dk.,"No, link","Bottom, half, almost 1/2 page",Yes,137,11 (by knowing how to change the settings),Scroll down ,"Not good: They only state that you can change your browser settings, but no information of how to do it. ",A general cookie description is given. No specific cookies listed. ,No,No. If you change browser settings to restrict cookies you get the pop up everytime you click 'accept'.,Yes,No,,,,,,
https://groruddalen.no/,Groruddalen,Norway,News,Yes,Mer informasjon,"No, link","Bottom, almost 1/2 page",Yes,401,2,Immediate,Good clarity: After the pop up you can click a button and deny cookies. The down side of this is described in 'Can you still read the content....',A general cookie description is given. No specific cookies listed. ,No,"Yes, but you get the pop up at every site you visit as they can not know that you have declined or acceptet (due to not keeping cookies). Their saying. ",Yes,No,,,,,,
https://opp.no/,Opp,Norway,News,No,-,-,"Bottom, entire",Yes,23,-,-,Not good: You can only accept. ,No cookie information. ,No,"If you change browser settings to block cookies you can still read articles, but you get the pop up at every page you visit. ",Yes,No,,,,,,
https://www.dagen.no/,Dagen,Norway,News,Yes,Les mer ,"No, link","Bottom, entire",Yes,3083,11 (by knowing how to change the settings),Scroll down ,"Not good: You have to llok through a lot of text to find how to block cookies, and they only link to sites for how to do it in Chrome, Safari and Windows Edge. I used Firefox. ",A general and understandable description of cookies and typical usage. No specific cookie information. ,No,"Yes, but you get the pop up at every site you visit and you need a subscription. ",Yes,No,,,,,,
https://fortune.com/,Fortune,The US ,News,Yes,Submit prefrences,Buttons,"Middle of page, middle","Yes, but greyed out ",519,4,Immediate,Very good: You can easily opt out of cookies based on categories. ,A general and understandable description of cookies based on categories was given. All cookie (comapnies) are listed. ,No,Yes,Yes,No,,,,,,
https://www.channel4.com/,Channel4,The UK,News,Yes,How to manage cookies,"No, link","Top, entrie, 1/3 of page",Yes,2771,"13 (from pop up, following their instructions to change browser settings, and back to main page)",Scroll down ,"Okay enough to understand: You have to look through some text, but it is not too much and it is divided into catrgories. You have to visit a third party website to get instructions on how to change browser settings.",An understandable description of cookies and different purposes of use is given. No specific cookies are listed. ,No,"Yes, but you get the pop up at every artivcle/site you visit.",Yes,No,,,,,,
https://www.cbc.ca/news,CBC,Canada,News,Yes,review you settings,"No, link","Bottom, entire",Yes,767,"15 (from pop up, following their instructions to change browser settings, and back to main page)",Scroll down ,Not good: You have to click your way through links on several pages to find information on how to block cookies in your browser settings. ,"A general description of cookies + more specific purposes of use is given. A list of all first and third party cookies are presented, together with their purpose. Downside: Difficult to find. ",No,Yes,Yes,No,,,,,,
https://www.dw.com/en/top-stories/s-9097,DW,Germany ,News,Yes,More info,"Yes, buttons","Bottom, entire ",Yes,2883,11 (by knowing how to change the settings),Scroll down ,"Not very good: They use two sentences to state that the page functions without cookies and that you can change your browser settings, without information about how to do this. ",Cookies and typical areas of used are described in an understandable way. Typical cookie companies are described together with their purpose. ,No,"Yes, but you get the pop up at every article/site you visit.",Yes,No,,,,,,
https://www.dagogtid.no/,DagOgTid,Norway,News,Yes,Les meir om cookies,"Yes, buttons","Bottom, left corner ",Yes ,884,10 (by knowing how to change the settings),Scroll down ,Not good. They do not state how to restrict or block cookies. ,"No. Cookies were not described, even though the title of the page was ""Personvern og nettkapsler"" (Privacy policy and cookies). ",No,"Yes. If you block cookies in browser settings you can still read their articles, and you do not get the GDPR pop up. ",Yes,No,,,,,,
https://www.firdatidend.no/,FridaTidende,Norway,News,Yes,Les mer om våre personvernregler og vår bruk av cookies.,"No, link","Bottom, entire",Yes,1197,"13 (from pop up, following their instructions to change browser settings, and back to main page)",Scroll down ,"Okay enough: From the pop up you get sent to a page about privacy, which has another link that directs you to a seperate page about cookies. In this page you are told that you can block cookies by changing browser settings, and they present  a list of the most typical browsers and links to pages with instructions on how to do this. ","Cookies are described in general and in categories. Every cookie used is listed, together with its purpose, time frame, and similar. ",No,"Yes, but you get the pop up at every article/site you visit.",Yes,No,,,,,,
https://idag.no/,Idag,Norway,News,Yes,Mer informasjon,"No, link ","Bottom, entire, almost 1/2 page",Yes,401,2,Immediate,Good clarity: After the pop up you can click a button and deny cookies. The down side of this is described in 'Can you still read the content....',A general cookie description is given. No specific cookies listed. ,No,"Yes, but you get the pop up at every site you visit as they can not know that you have declined or acceptet (due to not keeping cookies). Their saying. ",Yes,No,,,,,,
https://www.kanalen.no/,Kanalen,Norway,News,Yes,cookie-varsel,"No, link","Bottom, entire ",Yes,608,-,-,Not good: There is no information about how to delete or restrict cookies.,An understandable description of cookies and different purposes of use is given. All cookies used and their purpose + time frame is listed. ,No,"Yes, but you get the pop up at every article/site you visit.",Yes,No,,,,,,
https://www.klartale.no/,KlarTale,Norway,News,Yes,Personvernerklæring,"No, link ","Bottom, almost entire, 1/3 of page",Yes,3799,"10 (from pop up, following their instructions to change browser settings, and back to main page)",Scroll down ,"Not very good: There is a lot of text to look through. You can either opt out from some of third parties, download applications such as ghostery, or change browser settings. They redirect the user to all these alternatives. The reason the clearity is not very good is because it is too much text, and a bit confusing of what to do. ",An understandable description of cookies and different purposes of use is given. No specific cookies listed. ,No,"Yes, but you need a subscription. ",Yes,No,,,,,,
https://frostingen.no/,Frostingen,Norway,News,Yes,her,"No, link ","Bottom, left corner, small",Yes,722,-,Scroll down ,Not good: There is no information about how to delete or restrict cookies.,A vague description of cookies is given.,No,"Yes, but you have to be registered at their page. ",Yes,No,,,,,,
https://www.magazin24.se/,Magazin24,Sweeden,News ,Yes,Läs her,"No, link","Bottom, entire",Yes,271,10 (by knowing how to change the settings),Scroll down ,Not good: There is no information about how to delete or restrict cookies. They only state that you can change your browser settings or use incognito mode. ,A vague description of cookies is given.,No,"Yes, but pictures does not seem to work (blocked all cookies in browser settings) ",Yes,No,,,,,,
https://www.nlt.se/,NLT,Sweeden,News ,Yes,Läs mer om cookies och våra användarvillkor här.,"No, link","Bottom, right corner, 1/2 page",Yes,3880,10 (by knowing how to change the settings),Scroll down ,"Not very good: You can directly change some settings on you Facebook profile, use youronlinechoises (which I do not think work properly), or change browser settings, but the last one is not described how to do. ",A general cookie description is given. No specific cookies listed. ,No,"Yes, but you get the pop up at every article/site you visit. (Changed browser settings)",Yes,No,,,,,,
https://www.dagensvimmerby.se/,DagensVimmerby,Sweeden,News ,Yes,Här kan du läse mer om cookies. ,"No, link","Top, entire ",Yes,192,10 (by knowing how to change the settings),Scroll down ,"Not good: They have one sentence stating that the user can change the borwser settings, but withour telling how. ",A vague cookie description is given. No specific cookies listed. ,No,Yes ,Yes,No,,,,,,
http://flamman.se/,Flamman,Sweeden,News ,Yes,Läs mer. ,"No, link ","Bottom, entire",Yes,1183,11 (by knowing how to change the settings),Scroll down ,"Not good: They have one sentence stating that the user can change the borwser settings, but withour telling how. ",A vague cookie description is given. No specific cookies listed. ,No,Yes,Yes,No,,,,,,
